{
  "$schema": "https://json-schema.org/draft/2020-12/schema",
  "title": "VR Tour Definition",
  "description": "Schema for SBHS VR tour YAML files",
  "type": "object",
  "required": ["name", "description", "thumbnail", "startLocation", "locations"],
  "additionalProperties": false,
  "properties": {
    "name": { "type": "string", "minLength": 1 },
    "description": { "type": "string", "minLength": 1 },
    "thumbnail": { "type": "string", "pattern": "^[a-z0-9]+(-[a-z0-9]+)*-thumb\\.jpg$" },
    "startLocation": { "type": "string", "pattern": "^[a-z0-9]+(-[a-z0-9]+)*$" },
    "locations": {
      "type": "array",
      "minItems": 1,
      "items": { "$ref": "#/$defs/location" }
    }
  },
  "$defs": {
    "location": {
      "type": "object",
      "required": ["id", "name", "media", "connections"],
      "additionalProperties": false,
      "properties": {
        "id": { "type": "string", "pattern": "^[a-z0-9]+(-[a-z0-9]+)*$" },
        "name": { "type": "string", "minLength": 1 },
        "description": { "type": "string" },
        "media": { "type": "string", "pattern": "^[a-z0-9]+(-[a-z0-9]+)*\\.jpg$" },
        "thumbnail": { "type": "string", "pattern": "^[a-z0-9]+(-[a-z0-9]+)*-thumb\\.jpg$" },
        "hotspots": { "type": "array", "items": { "$ref": "#/$defs/hotspot" } },
        "overlays": { "type": "array", "items": { "$ref": "#/$defs/overlay" } },
        "connections": { "type": "array", "items": { "type": "string", "pattern": "^[a-z0-9]+(-[a-z0-9]+)*$" } }
      }
    },
    "hotspot": {
      "type": "object",
      "required": ["target", "yaw", "pitch"],
      "additionalProperties": false,
      "properties": {
        "target": { "type": "string", "pattern": "^[a-z0-9]+(-[a-z0-9]+)*$" },
        "yaw": { "type": "number", "minimum": 0, "maximum": 360 },
        "pitch": { "type": "number", "minimum": -90, "maximum": 90 },
        "label": { "type": "string" }
      }
    },
    "overlay": {
      "type": "object",
      "required": ["text", "yaw", "pitch"],
      "additionalProperties": false,
      "properties": {
        "text": { "type": "string", "minLength": 1 },
        "yaw": { "type": "number", "minimum": 0, "maximum": 360 },
        "pitch": { "type": "number", "minimum": -90, "maximum": 90 }
      }
    }
  }
}
